{
  "$schema": "https://json-schema.org/draft/2020-12/schema",
  "$id": "https://zebkit.markzebley.com/schemas/component-manifest.schema.json",
  "title": "Zebkit Component Manifest",
  "description": "Hand-authored guidance layer of a component's contract: the slot vocabulary and semantics, usage guidance, and canonical examples. It never restates what code already declares — attributes, tokens, events, and variants stay derived from the Custom Elements Manifest, token modules, and variant registry. build:context merges this manifest with those derived sources into the per-component agent context; a build step emits each component's runtime slot-name list from it so unknown-slot warnings share one source of truth. lint:components keeps the round trip honest.",
  "type": "object",
  "required": ["tag", "purpose", "slots", "examples"],
  "additionalProperties": false,
  "properties": {
    "$schema": { "type": "string" },
    "tag": {
      "type": "string",
      "pattern": "^zbk-[a-z0-9]+(?:-[a-z0-9]+)*$",
      "description": "The custom element tag. Must have a declaration in custom-elements.json (the lint flags a manifest for a component that does not exist)."
    },
    "purpose": {
      "type": "string",
      "description": "One or two sentences: what the component is for. The first thing an agent reads when choosing a component."
    },
    "nativeElement": {
      "type": "string",
      "description": "The native element at the component's core (GRAMMAR.md §8), e.g. 'input', 'button'. Stated structurally so tooling need not parse it out of prose."
    },
    "useWhen": {
      "type": "array",
      "items": { "type": "string" },
      "description": "Situations this component is the right choice for, e.g. 'Input is prose-length or multi-line'."
    },
    "notWhen": {
      "type": "array",
      "items": {
        "type": "object",
        "required": ["case"],
        "additionalProperties": false,
        "properties": {
          "case": {
            "type": "string",
            "description": "The situation where this component is the wrong choice."
          },
          "instead": {
            "type": "string",
            "description": "What to reach for instead. When it starts with 'zbk-' the lint checks it is a real component tag."
          }
        }
      },
      "description": "Situations where another pattern is correct. The component-selection half of the contract."
    },
    "guidance": {
      "type": "array",
      "items": { "type": "string" },
      "description": "Component-level usage rules a design tool or AI must respect, e.g. 'A placeholder is never a substitute for label content.'"
    },
    "slots": {
      "type": "object",
      "minProperties": 1,
      "propertyNames": {
        "enum": [
          "default",
          "icon",
          "prefix",
          "suffix",
          "checked",
          "unchecked",
          "indeterminate"
        ]
      },
      "additionalProperties": { "$ref": "#/$defs/slot" },
      "description": "The component's slot contract, keyed by slot name ('default' = unnamed children). The manifest is the source of truth: build:context renders the Slots section from here (no @slot JSDoc), the generated runtime name list drives unknown-slot warnings, and the lint diffs declared names against the slot names the component source actually delivers (slotted()/renderIcon/affix call sites) in both directions. The enum above IS the shared vocabulary from GRAMMAR.md §7 — adding a name here is amending the spec."
    },
    "keyboard": {
      "type": "array",
      "items": {
        "type": "object",
        "required": ["keys", "does"],
        "additionalProperties": false,
        "properties": {
          "keys": {
            "type": "string",
            "description": "The key or combination, e.g. 'Space', 'ArrowDown', 'Escape'."
          },
          "does": {
            "type": "string",
            "description": "What happens, noting when it is native behavior the component preserves rather than implements."
          }
        }
      },
      "description": "The keyboard interaction contract (GRAMMAR.md §8). Omit only when the component adds nothing beyond ordinary native text editing."
    },
    "examples": {
      "type": "array",
      "minItems": 1,
      "items": { "$ref": "#/$defs/example" },
      "description": "Canonical markup, rendered into docs and agent context. The lint parses each html string and validates it: tags exist in custom-elements.json, attributes exist on the component, slot attributes name declared slots, variant values are registered. Examples are executable documentation — a renamed attribute breaks the build instead of silently lying to every reader."
    },
    "variantTiers": {
      "type": "object",
      "additionalProperties": {
        "enum": ["recommended", "situational", "discouraged"]
      },
      "description": "Usage tier per shipped variant, keyed by variant name (lint-checked against the variant registry). Only list variants that differ from the 'recommended' default. Advisory metadata for tooling — never changes generated CSS, mirroring utility-family tiers."
    },
    "related": {
      "type": "array",
      "items": {
        "type": "string",
        "pattern": "^zbk-[a-z0-9]+(?:-[a-z0-9]+)*$"
      },
      "description": "Components commonly considered alongside or composed with this one. Each must be a real component tag."
    }
  },
  "$defs": {
    "slot": {
      "type": "object",
      "required": ["description"],
      "additionalProperties": false,
      "properties": {
        "description": {
          "type": "string",
          "description": "What content belongs here and what the component does with it."
        },
        "required": {
          "type": "boolean",
          "default": false,
          "description": "True when the component computes an empty accessible name without this slot's content (unless an aria-* attribute supplies the name). Feeds the dev-mode accessible-name warning — one declaration, two renderings."
        },
        "presentational": {
          "type": "boolean",
          "default": false,
          "description": "True when the slot's rendered container is aria-hidden. Information presentational content carries must also live in the accessible name or description (GRAMMAR.md §7)."
        },
        "tokens": {
          "type": "object",
          "additionalProperties": false,
          "description": "Component tokens that govern slotted content. Each value must be a key in the component's token module (lint-checked).",
          "properties": {
            "size": {
              "type": "string",
              "description": "Token key sizing the slotted content, e.g. 'icon-size', 'indicator-size'."
            },
            "color": {
              "type": "string",
              "description": "Token key coloring the slotted content, e.g. 'affix-ink', 'indicator-color'."
            }
          }
        },
        "positions": {
          "type": "array",
          "items": { "enum": ["start", "end"] },
          "description": "Placements the slot honors via data-position (icon slots). Omit for slots with a fixed position."
        },
        "guidance": {
          "type": "array",
          "items": { "type": "string" },
          "description": "Slot-specific usage rules, e.g. the presentational-content rule spelled out for this slot."
        }
      }
    },
    "example": {
      "type": "object",
      "required": ["title", "html"],
      "additionalProperties": false,
      "properties": {
        "title": {
          "type": "string",
          "description": "Short label, e.g. 'Basic', 'Custom indicators'."
        },
        "html": {
          "type": "string",
          "description": "The authored markup as a consumer would write it (pre-upgrade light DOM). Parsed and validated by the lint."
        },
        "tier": {
          "enum": ["recommended", "situational", "discouraged"],
          "description": "Omit = recommended. 'discouraged' examples exist to show the anti-pattern by name; pair with 'why'."
        },
        "why": {
          "type": "string",
          "description": "Why this example is tiered as it is. Required in spirit for anything below recommended — say what breaks."
        }
      }
    }
  }
}
